Unnamed: 0,Id,Tweet Time,Url,Tweet Text,Likes Count,Reply Count,Retweet Count,Retweeted Tweet,User Id,User Name,User Location,Follower Count,Following Count,tweet_clean
560,1468831912131121155,2021-12-09 06:36:32+00:00,https://twitter.com/ekowboy2/status/1468831912131121155,"Janjinya lebih mudah mengatasi banjir Jakarta jika jadi Presiden..

setelah menjabat 7 tahun, atas nama investasi banjir merata seluruh tanah air. Silahkan dibantah ini fakta!!",2264,128,600,,,,,,,janji mudah banjir jakarta presiden jabat 7 nama investasi banjir tanah air silah ban fakta
561,1468771837404348416,2021-12-09 02:37:49+00:00,https://twitter.com/ekowboy2/status/1468771837404348416,"Pesantren &amp; lembaga pendidikan Islam harus berani mengungkap jika ada pelecehan seksual jgn ditutup demi jaga nama baik sekolah krn ini merusak Islam dari dalam

Para penjahat kelamin ini bukan ustad.. mereka iblis yg jual ayat demi memuaskan birahinya!! https://t.co/Sm6akaTvWW",1197,83,292,,,,,,,pesantren lembaga didik islam berani leceh seksual jgn tutup jaga nama sekolah krn rusak islam jahat kelamin ustad iblis yg jual ayat muas birah
562,1468206334394830853,2021-12-07 13:10:42+00:00,https://twitter.com/ekowboy2/status/1468206334394830853,"Libur Maulid yg cuma sehari digeser tapi pilkada &amp; nataru aman seolah pandemi telah usai..

Pintu kedatangan wisatawan asing tetap buka pdhl disitulah letak ancamannya &amp; cuan PCR tetap lancar ya buat yg berpergian.. nanti saat kasus naik rakyat pula yg disalahkan!!",1515,45,417,,,,,,,libur maulid yg geser pilkada nataru aman olah pandemi pintu wisatawan asing buka pdhl situ letak ancam cuan pcr lancar ya yg pergi rakyat yg salah
563,1467426495232495617,2021-12-05 09:31:54+00:00,https://twitter.com/ekowboy2/status/1467426495232495617,"Novia mati dibunuh berkali2
1. Karena diperkosa
2. Dipaksa Aborsi
3. Dianggap aib keluarga
4. Dicibir pezina
5. Dikhianati hukum

Kultur &amp; agama kita melarang sex bebas tapi mereka punya hak hidup, mendapat keadilan &amp; bertobat.. berpihak lah pada korban jika masih punya hati 🙏",2447,52,437,,,,,,,novia mati bunuh berkali2 1 perkosa 2 paksa aborsi 3 anggap aib keluarga 4 cibir zina 5 khianat hukum kultur agama larang sex bebas hak hidup adil tobat korban hati
564,1467282595519946753,2021-12-05 00:00:06+00:00,https://twitter.com/ekowboy2/status/1467282595519946753,"Jika pasal Aborsi yg dikenakan maka peran Randy hanya membantu hukuman max 5th &amp; tersangka utamanya Novia mayat yg tdk bisa membela diri

Pasal perkosaan &amp; kekerasan seksual tdk dipake, ironis hukum berpihak pd oknum setan bahkan mayat pun ditersangkakan!
 https://t.co/nF0fD2a5bi",1515,97,506,,,,,,,pasal aborsi yg kena peran randy bantu hukum max 5th sangka utama novia mayat yg tdk bela pasal perkosa keras seksual tdk dipake ironis hukum pd oknum setan mayat sangka
565,1466650474510049282,2021-12-03 06:08:16+00:00,https://twitter.com/ekowboy2/status/1466650474510049282,"Tolong bapak ini diundang ke Istana, kritiknya bagus biar presiden bisa dengar..

Bilang sehat dipenjara, ceritakan mimpi dipanggil polisi, ungkap data deforestasi dilaporkan.. Indeks demokrasi kita nyungsep ke got!!!
 https://t.co/GdqNnF31WT",936,108,287,,,,,,,tolong undang istana kritik bagus biar presiden dengar bilang sehat penjara cerita mimpi panggil polisi data deforestasi lapor indeks demokrasi nyungsep got
566,1466597798745296897,2021-12-03 02:38:57+00:00,https://twitter.com/ekowboy2/status/1466597798745296897,"Tuntutan massa reuni 212
1. Bebaskan IBHRS 
2. Stop krimialisasi Ulama
3. Ganyang koruptor
4. Usut pelanggar HAM km50
5. Hancurkan tirani &amp; Oligarki

Tdk berontak &amp; minta merdeka kenapa dibubarkan, diancam serta dimusuhi.. tolong penjelasan anda YTH prof @mohmahfudmd 🙏🙏",1198,31,341,,,,,,,tuntut massa reuni 212 1 bebas ibhrs 2 stop krimialisasi ulama 3 ganyang koruptor 4 usut langgar ham km50 5 hancur tirani oligarki tdk berontak merdeka bubar ancam musuh tolong yth prof
567,1465898116339539970,2021-12-01 04:18:40+00:00,https://twitter.com/ekowboy2/status/1465898116339539970,"Jendral Dudung ini knp ya suka sekali nyampuri urusan sipil bahkan bicara Agama yg bukan bidangnya..

Tuhan bukan orang &amp; bahasa Arab itu bahasa Quran jangan diolok-olok, fokus saja tumpas KKB jangan begaduh!! https://t.co/vQ04oK1O8i",1223,131,347,,,,,,,jendral dudung knp ya suka nyampuri urus sipil bicara agama yg bidang tuhan orang bahasa arab bahasa quran olok fokus tumpas kkb begaduh
568,1465859234969489414,2021-12-01 01:44:10+00:00,https://twitter.com/ekowboy2/status/1465859234969489414,"Buat yang curiga terus dengan Islam, cobalah datang ke reuni 212

disitu kalian akan melihat arti persaudaraan &amp; persatuan, Umat Islam cinta damai.. benteng kokoh penjaga NKRI!!",1143,29,204,,,,,,,curiga islam coba reuni 212 situ lihat arti saudara umat islam cinta damai benteng kokoh jaga nkri
569,1465600554470567937,2021-11-30 08:36:16+00:00,https://twitter.com/ekowboy2/status/1465600554470567937,"Ini kerumunan yg disengaja terjadi berkali-kali, tak mendidik &amp; jg merendahkan martabat rakyat

Tolong penjelasannya prof @mohmahfudmd knp izin keramaian reoni 212 tdk dikeluarkan, DIMANA KEADILAN!! 

Trenggalek 30/Nov https://t.co/DihEtykcCV",1545,159,552,,,,,,,kerumun yg sengaja kali didik jg rendah martabat rakyat tolong prof knp izin ramai reoni 212 tdk adil trenggalek 30 nov
570,1465480360209174530,2021-11-30 00:38:39+00:00,https://twitter.com/ekowboy2/status/1465480360209174530,"Presiden petugas partai
menteri pesuruh ormas

Jangan demi mendulang suara, satu ormas dianak emaskan lalu ormas lain dibubarkan.. bangsa ini milik semua golongan!!",731,22,135,,,,,,,presiden tugas partai menteri suruh ormas dulang suara ormas anak emas ormas bubar bangsa milik golong
571,1465325976384991237,2021-11-29 14:25:11+00:00,https://twitter.com/ekowboy2/status/1465325976384991237,"Wajar jika BUMN utangnya menggunung, Garuda bangkrut, bandara diserahkan ke asing, tol dijual..

Menteri BUMN sibuk jadi anggota ormas!! https://t.co/G59wM7NMxK",1169,83,262,,,,,,,wajar bumn utang gunung garuda bangkrut bandara serah asing tol jual menteri bumn sibuk anggota ormas
572,1465292848903819270,2021-11-29 12:13:33+00:00,https://twitter.com/ekowboy2/status/1465292848903819270,"Ini salah satu alasan logis mengapa reuni 212 harus terus digelar!!!

IBHRS tokoh pemersatu bangsa simbol perlawanan thdp kedzaliman &amp; penindasan dihina begini..

Tugas anjing menjilat majikan untuk dapat tulang, mulut lah kau yg najis!!!! https://t.co/NWgqZvFpTt",945,111,261,,,,,,,salah alas logis reuni 212 gelar ibhrs tokoh bangsa simbol lawan thdp kedzaliman tindas hina tugas anjing jilat majikan tulang mulut kau yg najis
573,1464917245977448453,2021-11-28 11:21:02+00:00,https://twitter.com/ekowboy2/status/1464917245977448453,"Mushola di stasiun kecil di jam sibuk antrinya panjang gak ada salahnya sholat di kereta selama memungkinkan

Sholat di masjid, rumah, kendaraan udah bener.. yg salah yg gak sholat apalagi nyinyir orang sholat!!  https://t.co/eHVwwWCq8n",1875,28,407,,,,,,,mushola stasiun jam sibuk antri gak salah sholat kereta sholat masjid rumah kendara udah bener yg salah yg gak sholat nyinyir orang sholat
574,1464566298528993287,2021-11-27 12:06:30+00:00,https://twitter.com/ekowboy2/status/1464566298528993287,"Anti mandatory vaccine &amp; KIPI

Membedah KIPI, Kedaruratan Vaksin, keamanan Obat Covid19 dll.. silahkan yang ketinggalan diskusinya bisa nonton disini 🙏🙏
https://t.co/O1Z3L6bGqU https://t.co/m8ujfNVRtC",54,1,12,,,,,,,anti mandatory vaccine kipi bedah kipi darurat vaksin aman obat covid19 dll silah tinggal diskusi nonton
575,1464262374941102085,2021-11-26 15:58:49+00:00,https://twitter.com/ekowboy2/status/1464262374941102085,"dr Gatut @Marimar_Aauw, dr Adit @dharmawiguna, mba @AgneesLS terima kasih diskusinya..

Izin tadi saya rekam untuk dishare agar yang ketinggalan bisa ikut menyimak, ditunggu space selanjutnya 🙏🙏",26,3,2,,,,,,,dr gatut dr adit mba terima kasih diskusi izin rekam dishare tinggal simak tunggu space
576,1464201054673723397,2021-11-26 11:55:09+00:00,https://twitter.com/ekowboy2/status/1464201054673723397,"Pada kemana ya buzzerp yang suka fitnah IBHRS pake fake chat.. 

Nih partai junjungan kalian kadernya mesum parah bini orang digarap di toilet!! 
https://t.co/voC3c0pEuN",1140,74,464,,,,,,,ya buzzerp suka fitnah ibhrs pake fake chat nih partai junjung kader mesum parah bini orang garap toilet
577,1464170603108130818,2021-11-26 09:54:09+00:00,https://twitter.com/ekowboy2/status/1464170603108130818,"Masih ada agenda stop krimialisasi Ulama.. maka reuni 212 masih layak untuk terus diselenggarakan 

Putihkan Jakarta.. bersihkan Indonesia dari kekuasaan yang menindas!! #UmatDukungReuni212",1299,44,373,,,,,,,agenda stop krimialisasi ulama reuni 212 layak selenggara putih jakarta sih indonesia kuasa tindas umatdukungreuni212
578,1464059940465569792,2021-11-26 02:34:25+00:00,https://twitter.com/ekowboy2/status/1464059940465569792,"Debat pro-kontra Vaksin

Silahkan teman-teman yang ketinggalan diskusinya, rugi kalo gak nonton🙏🙏
https://t.co/ENf4rTWp5q https://t.co/76Sjdy8QXY",35,0,5,,,,,,,debat pro - kontra vaksin silah teman tinggal diskusi rugi kalo gak nonton
579,1463695439778045952,2021-11-25 02:26:01+00:00,https://twitter.com/ekowboy2/status/1463695439778045952,"Kemesraan TNI &amp; FPI di palu, banten, aceh, lombok dimana ada bencana mereka terdepan bantu warga..

Kemesraan itu dirusak ambisi jenderal Baliho, sementara KKB yg bantai prajurit &amp; rakyat Papua mau dirangkul!! https://t.co/wf764VdMA3",3437,98,1186,,,,,,,mesra tni fpi palu banten aceh lombok bencana bantu warga mesra rusak ambisi jenderal baliho kkb yg bantai prajurit rakyat papua rangkul
580,1463457998559322117,2021-11-24 10:42:31+00:00,https://twitter.com/ekowboy2/status/1463457998559322117,"Ini yang langka dari Anies Baswedan dia tau betul arti demokrasi, siapapun bebas mengkritik &amp; tak pernah tergoda untuk memberangus yang berbeda.. https://t.co/EzWNLkosjW",1274,27,335,,,,,,,langka anies baswedan tau arti demokrasi bebas kritik goda berangus beda
581,1463438157941071877,2021-11-24 09:23:40+00:00,https://twitter.com/ekowboy2/status/1463438157941071877,"Sudah lah romo Benny masuk PDIP saja daripada lompat pagar ngurusin agama Islam

Bubarkan juga BPIP, Pancasila ideologi terbuka penafsirannya tdk boleh didikte lembaga fasis!!
 https://t.co/ozzRSw2M9h",348,8,88,,,,,,,romo benny masuk pdip lompat pagar ngurusin agama islam bubar bpip pancasila ideologi buka tafsir tdk dikte lembaga fasis
582,1463375063831302145,2021-11-24 05:12:58+00:00,https://twitter.com/ekowboy2/status/1463375063831302145,"FPI gak pernah bakar bendera merah putih, gak pernah bunuh warga.. dibubarkan bahkan diframing teroris

KKB bakar bendera merah putih, tak mengakui NKRI, bunuh sipil &amp; militer.. mereka saudara kita bukan teroris

Galak ke Baliho, ciut ke KKB!",3559,176,1309,,,,,,,fpi gak bakar bendera merah putih gak bunuh warga bubar diframing teroris kkb bakar bendera merah putih nkri bunuh sipil militer saudara teroris galak baliho ciut kkb
583,1463129261892538373,2021-11-23 12:56:14+00:00,https://twitter.com/ekowboy2/status/1463129261892538373,"Daripada gratiskan toilet SPBU, netizen tantang Erick Thohir gratisan PCR!!!

Yg setuju silahkan retweet!!
Selengkapnya...
https://t.co/8HIjqHGeAM https://t.co/JNAIgmK8y2",749,22,494,,,,,,,gratis toilet spbu netizen tantang erick thohir gratis pcr yg tuju silah retweet lengkap
584,1463063658108370948,2021-11-23 08:35:33+00:00,https://twitter.com/ekowboy2/status/1463063658108370948,"Parkir liar &amp; toilet berbayar mau ditertibkan tapi lapangan kerja gak disediakan..

Ada lapangan kerja tapi buat TKA, Pejabat mah enak udah digaji negara masih bisnis PCR!!! https://t.co/lODF5krru2",2109,61,601,,,,,,,parkir liar toilet bayar tertib lapang kerja gak sedia lapang kerja tka jabat mah enak udah gaji negara bisnis pcr
585,1462700557701840899,2021-11-22 08:32:43+00:00,https://twitter.com/ekowboy2/status/1462700557701840899,"Mungkin Arteria Dahlan merasa anggota Dewan sdh dilindungi pasal penghinaan ditambah lagi dari partai pemenang pemilu juga dekat dg Presiden 

Jadi merasa berhak menjarain rakyat padahal kelakuannya lebih parah &amp; memalukan!!! https://t.co/fKF9OOGZva",1878,195,724,,,,,,,arteria dahlan anggota dewan sdh lindung pasal hina partai menang milu dg presiden hak menjarain rakyat laku parah malu
586,1462670918954618883,2021-11-22 06:34:56+00:00,https://twitter.com/ekowboy2/status/1462670918954618883,"Rakyat yang kritik pemerintah siap-siap dikritik balik ya.. KTP mu mana, sudah bayar pajak belum, suka lewat jalan tol gak

Makin aneh kelakuan rezim!!
https://t.co/7tPhHli9MV",630,108,177,,,,,,,rakyat kritik perintah kritik ya ktp mu bayar pajak suka jalan tol gak aneh laku rezim
587,1462634216051466250,2021-11-22 04:09:06+00:00,https://twitter.com/ekowboy2/status/1462634216051466250,"Salah satu sebab turunnya musibah bertubi-tubi karena kedzaliman terhadap Ulama..

Penguasa yang berbuat rakyat yg menanggung akibat, bebaskan IBHRS.. Stop kriminalisasi Ulama!! #SaveUlama",1458,41,320,,,,,,,salah turun musibah tubi kedzaliman hadap ulama kuasa rakyat yg tanggung akibat bebas ibhrs stop kriminalisasi ulama saveulama
588,1462381657869078533,2021-11-21 11:25:31+00:00,https://twitter.com/ekowboy2/status/1462381657869078533,"Sudah boleh balapan, demo, sekolah, pasar kembali ramai, jalanan macet &amp; gak ada lagi yg teriak prokas.. prokes..

Sudah saatnya IBHRS dibebaskan, hentikan segala bentuk kezaliman pada Ulama!!",1561,28,392,,,,,,,balap demo sekolah pasar ramai jalan macet gak yg teriak prokas prokes ibhrs bebas henti bentuk zalim ulama
589,1462052185915625476,2021-11-20 13:36:19+00:00,https://twitter.com/ekowboy2/status/1462052185915625476,"Ada apa, dibalik pertemuan..
Farid Okbah &amp; Anies Baswedan

Menjawab fitnah keji Anies dekat dg teroris &amp; mengapa pertemuan FAO dg Jokowi tidak digoreng!!

Selengkapnya.. https://t.co/wA8qMOTIQQ https://t.co/59djp65qmk",296,8,84,,,,,,,temu farid okbah anies baswedan fitnah keji anies dg teroris temu fao dg jokowi goreng lengkap
590,1461863484778430470,2021-11-20 01:06:29+00:00,https://twitter.com/ekowboy2/status/1461863484778430470,"CAK NUN: Jika Tidak Berbuat Sesuatu Dalam Setahun Ini Oligarki Kembali Berkuasa!!

Tonton selengkapnya...
https://t.co/0dmShipIwm https://t.co/EH3EhmrKAD",1885,34,636,,,,,,,cak nun oligarki kuasa tonton lengkap
591,1461639118157271041,2021-11-19 10:14:56+00:00,https://twitter.com/ekowboy2/status/1461639118157271041,"DUKUNGAN UNTUK MUI

Netizen bersatu beri dukungan MUI melawan anasir jahat yg ingin benturan agama dg negara!!

Silahkan tonton diskusinya🙏🙏
https://t.co/Tt6VpD0k2w https://t.co/GLUWchrj4Z",410,3,80,,,,,,,dukung mui netizen dukung mui lawan anasir jahat yg bentur agama dg negara silah tonton diskusi
592,1461334556796014592,2021-11-18 14:04:43+00:00,https://twitter.com/ekowboy2/status/1461334556796014592,"DUKUNGAN UNTUK MUI 

Silahkan buat teman2 yg mau bergabung 🙏🙏
https://t.co/gJYfG6vFZD",442,34,129,,,,,,,dukung mui silah teman2 yg gabung
593,1461262110306889737,2021-11-18 09:16:50+00:00,https://twitter.com/ekowboy2/status/1461262110306889737,"Moeldoko dipermalukan, diusir dan diteriaki penjahat HAM di basis pendukung Jokowi

Tanda2 alam kejatuhan.. 
rezim oligarki!!

Tonton selengkapnya..
https://t.co/eUSV8DIQfc https://t.co/sxVNPkMksf",774,30,225,,,,,,,moeldoko malu usir riak jahat ham basis dukung jokowi tanda2 alam jatuh rezim oligarki tonton lengkap
594,1461211779720114180,2021-11-18 05:56:50+00:00,https://twitter.com/ekowboy2/status/1461211779720114180,"Space kita nanti malam
""Dukungan untuk MUI""
Saya mengundang seluruh netizen untuk bersuara mendukung MUI dari rongrongan jahat yg sedang membenturkan agama dg negara

Naikan terus tagarnya #dukungMUI Jika bukan kita umat Islam yang menjaga MUI siapa lagi!!",1401,219,533,,,,,,,space malam dukung mui undang netizen suara dukung mui rongrong jahat yg bentur agama dg negara tagar dukungmui umat islam jaga mui
595,1461170390030446592,2021-11-18 03:12:22+00:00,https://twitter.com/ekowboy2/status/1461170390030446592,"Foto ini bikin cebong kelojotan!!

Dan silahkan cek YT ini https://t.co/mceuqX4PZL, apakah ulama yg yang berdakwah dg kelembutan seperti ini punya ciri teroris!! #dukungMUI https://t.co/nUdXQE7Riw",1449,97,629,,,,,,,foto bikin cebong kelojot silah cek yt ulama yg dakwah dg lembut ciri teroris dukungmui
596,1461139725859753985,2021-11-18 01:10:31+00:00,https://twitter.com/ekowboy2/status/1461139725859753985,"Sejak dulu kriminalisasi terhadap Ulama.. Buya Hamka, M Natsir &amp; tokoh Masyumi tdk ada yg terbukti.. mereka korban rezim diktator

Kini Ulama ditangkapi dg tuduhan keji &amp; narasi fitnah buzzerp

SEJARAH SELALU TERULANG.. Ingat orde lama tungbang setelah marak penangkapan Ulama!!",549,17,181,,,,,,,kriminalisasi hadap ulama buya hamka m natsir tokoh masyumi tdk yg bukti korban rezim diktator ulama tangkap dg tuduh keji narasi fitnah buzzerp sejarah ulang orde tungbang marak tangkap ulama
597,1461006928734142470,2021-11-17 16:22:50+00:00,https://twitter.com/ekowboy2/status/1461006928734142470,"HTI &amp; FPI adalah ormas yang paling getol mendorong kasus penistaan agama Ahok.. dan kini keduanya sudah dibubarkan

MUI yg keluarkan fatwa kini jadi target selanjutnya.. jadi ini dendam lama bersemi kembali!!",1320,81,401,,,,,,,hti fpi ormas getol dorong nista agama ahok bubar mui yg fatwa target dendam semi
598,1460929841314758656,2021-11-17 11:16:31+00:00,https://twitter.com/ekowboy2/status/1460929841314758656,"Saat Pilpres MUI dijadikan  kendaraan untuk mendulang suara setelah terpilih, MUI mau dibubarkan

Sejak Republik ini berdiri baru di rezim ini ada wacana bubarkan MUI.. mungkin mereka sudah tak butuh umat Islam krn MUI berisikan Ulama dari perwakilan seluruh ormas Islam!!",1697,102,469,,,,,,,pilpres mui kendara dulang suara pilih mui bubar republik rezim wacana bubar mui butuh umat islam krn mui risi ulama wakil ormas islam
599,1460888880337469442,2021-11-17 08:33:45+00:00,https://twitter.com/ekowboy2/status/1460888880337469442,"MUI lembaga terhormat yg sangat dicintai &amp; fatwanya diikuti umat disejajarkan dg maling &amp; koruptor.. 

Pdhl merekalah maling bansos &amp; penjahat kemanusiaan yg tega menghisap darah rakyat dg bisnis PCR!! https://t.co/FeVkjq69bK",990,55,307,,,,,,,mui lembaga hormat yg cinta fatwa umat sejajar dg maling koruptor pdhl maling bansos jahat manusia yg tega menghisap darah rakyat dg bisnis pcr
600,1460793897790021633,2021-11-17 02:16:20+00:00,https://twitter.com/ekowboy2/status/1460793897790021633,"KONTROVERSI PERMENDIKBUD 
Part 2

Diskusi paling lengkap konstruksi hukum, detail pelaksanaan, frasa ""Consent"" dikupas tuntas.. Silahkan ditonton 🙏🙏 
👉https://t.co/Ult1ekXQyu https://t.co/4bfLIX8KdA",29,0,5,,,,,,,kontroversi permendikbud part 2 diskusi lengkap konstruksi hukum detail laksana frasa consent kupas tuntas silah tonton
601,1460517464727375878,2021-11-16 07:57:53+00:00,https://twitter.com/ekowboy2/status/1460517464727375878,"Pindah Ibukota cuma kedok buat nebang-nebangin hutan di Kalimantan agar tidak dilawan warga..

Hasilnya banjir besar yg belum pernah ada sajak zaman Ken Arok https://t.co/rTTIW8lAOb",2345,61,896,,,,,,,pindah ibukota kedok nebang - nebangin hutan kalimantan lawan warga hasil banjir yg sajak zaman ken arok
602,1460405120139554816,2021-11-16 00:31:28+00:00,https://twitter.com/ekowboy2/status/1460405120139554816,"Tak ada korban jiwa,tak ada benturan fisik &amp; huru-hara yg ancam keamanan nasional, keonaran hanya terjadi di media sosial yg dipenuhi akun bot

Penahanan IBHRS adalah kedzaliman sangat tak layak walau sedetik, mestinya mafia PCR yg dipenjarakan!! https://t.co/QHhNFiwNpI",2130,75,715,,,,,,,korban jiwa bentur fisik huru-hara yg ancam aman nasional onar media sosial yg penuh akun bot tahan ibhrs kedzaliman layak detik mesti mafia pcr yg penjara
603,1459882860500832263,2021-11-14 13:56:11+00:00,https://twitter.com/ekowboy2/status/1459882860500832263,"KONTROVERSI PERMENDIKBUD 
Part 2

Silahkan buat teman2 yg mau gabung 🙏🙏
https://t.co/IZQItiFONc",74,5,18,,,,,,,kontroversi permendikbud part 2 silah teman2 yg gabung
604,1459858067403673602,2021-11-14 12:17:40+00:00,https://twitter.com/ekowboy2/status/1459858067403673602,"Tema diskusi space kita 
malam ini pukul 21.00: 
KONTROVERSI PERMENDIKBUD 
Part 2

Silahkan buat teman2 yang mau gabung &amp; tolong bantu sebarkan 🙏🙏 https://t.co/tI5imFn9ba",95,6,31,,,,,,,tema diskusi space malam 21 00 kontroversi permendikbud part 2 silah teman2 gabung tolong bantu sebar
605,1459734758951309314,2021-11-14 04:07:41+00:00,https://twitter.com/ekowboy2/status/1459734758951309314,"Tak seorang pun dari pendukung rezim yg bicara banjir Sintang 35 ribu rumah terendam selama 3 minggu akibat deforestasi

Genangan di Jakarta media &amp; buzzerp ribut seperti langit mau runtuh!! https://t.co/b1tpl6lGsL",5466,298,2768,,,,,,,orang dukung rezim yg bicara banjir sintang 35 ribu rumah rendam 3 minggu akibat deforestasi genang jakarta media buzzerp ribut langit runtuh
606,1459505130806464521,2021-11-13 12:55:14+00:00,https://twitter.com/ekowboy2/status/1459505130806464521,"Bongkar Hoax Perbedaan Darah Setelah Divaksin!!

Tonton selengkapnya.. 🙏🙏
👉 https://t.co/lMEN48s8zl https://t.co/LN6JY6akcX",73,2,16,,,,,,,bongkar hoax beda darah vaksin tonton lengkap
607,1459133753607868416,2021-11-12 12:19:30+00:00,https://twitter.com/ekowboy2/status/1459133753607868416,"@Stakof Ini sudah ya Gus 🙏🙏
👉 https://t.co/H7afK3f3nG",5,0,0,,68331085.0,Stakof,Kadipaten Japara Hadiningrat,116028.0,1535.0,ya gus
608,1459054299586068488,2021-11-12 07:03:47+00:00,https://twitter.com/ekowboy2/status/1459054299586068488,"KONTROVERSI 
PERMENDIKBUD 30

Silahkan teman-teman yang ketinggalan diskusi panas &amp; tajam, rugi banget kalo gak nonton 🙏🙏
👉 https://t.co/H7afK3f3nG https://t.co/XvY8X78lTu",134,5,28,,,,,,,kontroversi permendikbud 30 silah teman tinggal diskusi panas tajam rugi banget kalo gak nonton
609,1458795764461682693,2021-11-11 13:56:28+00:00,https://twitter.com/ekowboy2/status/1458795764461682693,"KONTROVERSI PERMENDIKBUD 

Silahkan buat teman2 yang mau gabung 🙏🙏 https://t.co/C4I7mnp4F9",112,11,38,,,,,,,kontroversi permendikbud silah teman2 gabung
610,1458753576637927427,2021-11-11 11:08:49+00:00,https://twitter.com/ekowboy2/status/1458753576637927427,"Tema diskusi space kita 
malam ini pukul 21.00: 
KONTROVERSI PERMENDIKBUD 

Silahkan buat teman2 yang mau gabung &amp; tolong bantu sebarkan 🙏🙏 https://t.co/sndWLuxh4K",306,9,89,,,,,,,tema diskusi space malam 21 00 kontroversi permendikbud silah teman2 gabung tolong bantu sebar
611,1458595790838910979,2021-11-11 00:41:50+00:00,https://twitter.com/ekowboy2/status/1458595790838910979,"Wajar jika permendikbud ini ditolak Muhammadiyah mereka punya 30.000an sekolah dan 176 Universitas..

Kekerasan seksual dilarang tapi melindungi sex di luar nikah dengan persetujuan, kampus tempat menimba Ilmu bkn tempat buang janin!!",1599,31,450,,,,,,,wajar permendikbud tolak muhammadiyah 30 000an sekolah 176 universitas keras seksual larang lindung sex nikah tuju kampus timba ilmu bkn buang janin
612,1458270580755496960,2021-11-10 03:09:34+00:00,https://twitter.com/ekowboy2/status/1458270580755496960,"Senang lihat pemimpin seperti ini mampu tertawa lepas bersama para pengkritiknya.. gak nyambi jualan bakso

Dan pendukungnya juga woles gak membabi buta &amp; lopar-lapor!!
 https://t.co/5Hc4AKxldv",2778,128,636,,,,,,,senang lihat pimpin tertawa lepas kritik gak nyambi jual bakso dukung woles gak babi buta lopar - lapor
613,1458244423016280066,2021-11-10 01:25:37+00:00,https://twitter.com/ekowboy2/status/1458244423016280066,"Pasar PCR terbesar ada disini, jadi dibuat seolah gawat..

Sudah dijawab ya Pak Luhut yang terhormat, Jakarta landai jangan mengadi ngadi!! https://t.co/uUHNxckLvj",590,14,151,,,,,,,pasar pcr olah gawat ya luhut hormat jakarta landai adi ngadi
614,1458071137120780293,2021-11-09 13:57:03+00:00,https://twitter.com/ekowboy2/status/1458071137120780293,"WAJIB UJI EMISI

Anies dikritik pendukungnya, Silahkan teman-teman yang ketinggalan diskusi langka tapi tetap tajam, rugi kalo gak nonton 🙏🙏
👉 https://t.co/00uXTRxDSJ https://t.co/Ux0Mo7PXOv",61,6,9,,,,,,,wajib uji emisi anies kritik dukung silah teman tinggal diskusi langka tajam rugi kalo gak nonton
615,1457999575856271363,2021-11-09 09:12:41+00:00,https://twitter.com/ekowboy2/status/1457999575856271363,"Ok saya sdh mampir ke https://t.co/stulozfE8v &amp; yg bisa mengakses bukti transaksi hanyalah pembeli..

Jadi mereka beli sendiri &amp; screenshot sendiri untuk bahan fitnah murahan, kalo partainya bisa bikin warga keracunan apalagi cuma fitnah ya!! https://t.co/xVmmY8L08w",1456,77,515,,,,,,,ok sdh mampir yg akses bukti transaksi beli beli screenshot bahan fitnah murah kalo partai bikin warga racun fitnah ya
616,1457874036457807879,2021-11-09 00:53:50+00:00,https://twitter.com/ekowboy2/status/1457874036457807879,"Jika ada pejabat yang jadikan pandemi ini ladang bisnis untuk memperkaya diri, dia akan mati ditawur rakyatnya sendiri..

Yang setuju silahkan retweet!! https://t.co/IqsOhgCflg",3247,61,1517,,,,,,,jabat pandemi ladang bisnis kaya mati tawur rakyat tuju silah retweet
617,1457639174882791428,2021-11-08 09:20:35+00:00,https://twitter.com/ekowboy2/status/1457639174882791428,"Akhirnya rakyat mengerti mengapa komando penanganan covid19 tdk berasal dari kalangan medis...

Karena mereka kurang mampu membaca peluang 😎
 https://t.co/CsSifPDuTD",2182,80,688,,,,,,,rakyat erti komando tangan covid19 tdk kalang medis baca peluang
