Unnamed: 0,Id,Tweet Time,Url,Tweet Text,Likes Count,Reply Count,Retweet Count,Retweeted Tweet,User Id,User Name,User Location,Follower Count,Following Count,tweet_clean
796,1418113580243701764,2021-07-22 07:39:59+00:00,https://twitter.com/ekowboy2/status/1418113580243701764,"Pak Prabowo
Mak Megawati
Airlangga Hartanto
Suharso Monoarfa

Rektor UI rangkap jabatan mundur.. 
Ketum partai rangkap jabatan KAPAN!!!",590,19,180,,,,,,,prabowo mak megawati airlangga hartanto suharso monoarfa rektor ui rangkap jabat mundur tum partai rangkap jabat
797,1417784684914741249,2021-07-21 09:53:04+00:00,https://twitter.com/ekowboy2/status/1417784684914741249,"Imam Ali VS Yahudi kalah di pengadilan, Nabi SAW pun bersabda: andai Fatimah anak ku mencuri ku patahkan sendiri tangannya.. 

Kini selevel Rektor bisa paksa Presiden rubah aturan maka jangan heran BUZZERP kebal hukum!!!",911,12,252,,,,,,,imam ali vs yahudi kalah adil nabi saw sabda andai fatimah anak ku curi ku patah tangan level rektor paksa presiden rubah atur heran buzzerp kebal hukum
798,1417668548621606920,2021-07-21 02:11:35+00:00,https://twitter.com/ekowboy2/status/1417668548621606920,"PPKM Mikro
PPKM Sedang
PPKM Terbatas
PPKM Ketat
PPKM Transisi
PPKM Darurat
PPKM Level 1-4

Yg nampak di mata rakyat fokusnya cuma ganti2 nama agar terhindar dari kewajiban memberi makan rakyat!!",1367,65,432,,,,,,,ppkm mikro ppkm ppkm batas ppkm ketat ppkm transisi ppkm darurat ppkm level 1 - 4 yg nampak mata rakyat fokus ganti2 nama hindar wajib makan rakyat
799,1417392860442234883,2021-07-20 07:56:06+00:00,https://twitter.com/ekowboy2/status/1417392860442234883,"KAU YANG BERJANJI..
KAU YANG MENGINGKARI.. https://t.co/yr6X6KU6R8",968,50,392,,,,,,,kau janji kau ingkar
800,1417036450680348673,2021-07-19 08:19:51+00:00,https://twitter.com/ekowboy2/status/1417036450680348673,Pak Jokowi kalo masih bingung PPKM darurat mau lanjut atau enggak lihat ini pak.. 😭😭😭 https://t.co/dJsdMrzjaO,669,25,268,,,,,,,jokowi kalo bingung ppkm darurat lihat
801,1416784973877547019,2021-07-18 15:40:35+00:00,https://twitter.com/ekowboy2/status/1416784973877547019,"Janji Jokowi Agustus Jakarta &amp; Bali sudah terbentuk HERD IMMUNITY, menang melawan corona.. cuma PHP!!

Silakan simak ulasanya di youtube channel saya 🙏🙏
https://t.co/VQGFBis4Ir https://t.co/EzlxXG8hMt",150,12,44,,,,,,,janji jokowi agustus jakarta bal bentuk herd immunity menang lawan corona php sila simak ulasanya youtube channel
802,1416404680930852865,2021-07-17 14:29:26+00:00,https://twitter.com/ekowboy2/status/1416404680930852865,"Jokowi ngamuk menterinya tak punya empati pada pelesiran 

Lord Luhut akhirnya minta maaf PPKM darurat tak optimal

Setelah dibela mati2an akhirnya vaksin berbayar dibatalkan

Menko PMK direvisi Menko Polhukam terkait darurat Militer

DULU SBY NGAPAIN AJA!
https://t.co/GDnZlfDi0s",761,84,221,,,,,,,jokowi ngamuk menteri empati pelesir lord luhut maaf ppkm darurat optimal bela mati2an vaksin bayar batal menko pmk revisi menko polhukam kait darurat militer sby ngapain aja
803,1416338091829194753,2021-07-17 10:04:50+00:00,https://twitter.com/ekowboy2/status/1416338091829194753,"Jaksa yang menuntut 6 tahun penjara &amp; menuding gelar Imam Besar HABIB RIZIEQ hanya isapan jempol belaka... Meninggal dunia

Simak ulasannya di youtube channel saya 🙏🙏 https://t.co/9HnvAiq8JH https://t.co/G9Y0Fbe2ae",811,21,204,,,,,,,jaksa tuntut 6 penjara tuding gelar imam habib rizieq isap jempol belaka tinggal dunia simak ulas youtube channel
804,1416227206552952834,2021-07-17 02:44:12+00:00,https://twitter.com/ekowboy2/status/1416227206552952834,"Di India 20 menterinya sudah mundur, disini kasus positif &amp; kematiannya juara dunia boro² mundur minta maaf pun tidak.. menterinya malah pelesiran, jualan obat &amp; jadi pengamat sinetron

MIRIS!! Empati sudah hanyut ke gorong-gorong!! https://t.co/1JKOQCPh3l",3254,174,908,,,,,,,india 20 menteri mundur positif mati juara dunia boro2 mundur maaf menteri pelesir jual obat sinetron miris empati hanyut gorong-gorong
805,1416062908685971456,2021-07-16 15:51:21+00:00,https://twitter.com/ekowboy2/status/1416062908685971456,"Jaksa yg pongah menyebut gelar Imam Besar hanya isapan jempol belaka.. kini telah terkapar menghadap Tuhannya tanpa membawa harta, pangkat &amp; jabatan yg dia banggakan!!

Betapa kecil manusia dihadapan Allah SWT, tak berdaya melawan virus berukuran 0,01 mikron",2566,62,731,,,,,,,jaksa yg pongah gelar imam isap jempol belaka kapar hadap tuhan bawa harta pangkat jabat yg bangga betapa manusia hadap allah swt daya lawan virus ukur 0 01 mikron
806,1415960553063817218,2021-07-16 09:04:37+00:00,https://twitter.com/ekowboy2/status/1415960553063817218,"Hakimnya sudah menghadap Tuhan, Jaksanya menyusul hari ini..

Saya selalu sedih mendengar berita kematian kecuali trhdp pelaku kedzaliman terlebih trhdp Ulama.. SAMPAI JUMPA DI PENGADILAN AKHIRAT!!!",2114,65,485,,,,,,,hakim hadap tuhan jaksa susul sedih dengar berita mati kecuali trhdp laku kedzaliman trhdp ulama jumpa adil akhirat
807,1415300121378529282,2021-07-14 13:20:18+00:00,https://twitter.com/ekowboy2/status/1415300121378529282,"Akhir² ini jadi sering nangis tiap buka TL.. sedih lihat bnyk yg gak bisa makan, sedih bnyk yg panik gak dapat RS, sedih lihat panjangnya antrean oksigen, sedih bnyknya berita duka dimana²

YA RABB... SELAMATKAN KAMI DARI PEMIMPIN YG TAK BERGUNA!! 🤲🤲",1499,74,376,,,,,,,akhir2 nang buka tl sedih lihat bnyk yg gak makan sedih bnyk yg panik gak rs sedih lihat antre oksigen sedih bnyknya berita duka dimana2 ya rabb selamat pimpin yg
808,1414988494066253830,2021-07-13 16:42:00+00:00,https://twitter.com/ekowboy2/status/1414988494066253830,"Lois diseret ke jalur hukum fansnya makin banyak, represif ciri negara gagal!!

Saksikan selengkapnya di channel youtube saya 🙏🙏
https://t.co/s3DD7okGBq https://t.co/c0t4jVKD5P",222,10,59,,,,,,,lois seret jalur hukum fansnya represif ciri negara gagal saksi lengkap channel youtube
809,1414829535237869583,2021-07-13 06:10:22+00:00,https://twitter.com/ekowboy2/status/1414829535237869583,"Saya tidak sependapat dg Lois, tapi urusan rakyat mau percaya atau tidak dg corona negara tdk boleh ikut campur apalagi dg tangan besi penjarakan orang biarlah rakyat cerdas dg caranya sendiri!!

Toh pimpinan MPR saja masih percaya keris bisa berdiri gak ada yg ribut!!!",854,30,220,,,,,,,dg lois urus rakyat percaya dg corona negara tdk campur dg tangan besi penjara orang biar rakyat cerdas dg pimpin mpr percaya keris gak yg ribut
810,1414530595833581571,2021-07-12 10:22:29+00:00,https://twitter.com/ekowboy2/status/1414530595833581571,"Vaksin covid19 mulai dijual..
Kejam, Negara cari untung ditengah situasi darurat!!

Silahkan ditonton channel youtube saya 🙏🙏
https://t.co/LRx39Qky45 https://t.co/6lAbGG0xMa",131,6,45,,,,,,,vaksin covid19 jual kejam negara cari untung situasi darurat silah tonton channel youtube
811,1413103650327519234,2021-07-08 11:52:19+00:00,https://twitter.com/ekowboy2/status/1413103650327519234,"Nih jejak digital abu janda yang gak percaya covid19, provokasi warga buat keluar rumah, bahkan ngebully Anies yg menerapkan PSBB

Semoga Yang Maha Kuasa segera mengabulkan keinginannya 🤲 https://t.co/cw8nNeucSD",2321,218,1161,,,,,,,nih jejak digital abu janda gak percaya covid19 provokasi warga rumah ngebully anies yg terap psbb moga maha kuasa kabul
812,1413044268411736071,2021-07-08 07:56:21+00:00,https://twitter.com/ekowboy2/status/1413044268411736071,"Kata LBP bangsa ini beruntung punya presiden Jokowi

Yang benar bangsa ini beruntung jika presidennya masih SBY.. dia gak pernah suruh pembantunya maju saat situasi darurat, dia pimpin sendiri peperangan hingga tuntas &amp; gak anti kritik!!",2133,82,475,,,,,,,lbp bangsa untung presiden jokowi bangsa untung presiden sby gak suruh bantu maju situasi darurat pimpin peperangan tuntas gak anti kritik
813,1412943994305191942,2021-07-08 01:17:54+00:00,https://twitter.com/ekowboy2/status/1412943994305191942,"Saat Anies ajukan pengetatan sejak mei, malah ditolak

Saat nakes teriak knp wisata dibuka padahal mudik dilarang, tak peduli

Saat semua pihak mengecam masuknya TKA China, rakyat diancam

Giliran covid19 melonjak rakyat disalahkan, sudahlah kibarkan bendera putih! https://t.co/BbmBMlBkSD",1681,69,662,,,,,,,anies aju ketat mei tolak nakes teriak knp wisata buka mudik larang peduli kecam masuk tka china rakyat ancam gilir covid19 lonjak rakyat salah kibar bendera putih
814,1412390445619945483,2021-07-06 12:38:17+00:00,https://twitter.com/ekowboy2/status/1412390445619945483,"Yang kita lihat penindakan PPKM darurat oleh aparat hanya menyasar rakyat kecil yg tak berdaya, baru Gub DKI yg berani sidak ke kantor &amp; gedung besar dg keamanan super ketat

Terima kasih pak Anies sdh menunjukan keadilan masih ada di negeri ini meskipun sdh langka!!",1686,26,439,,,,,,,lihat tindak ppkm darurat aparat sasar rakyat yg daya gub dki yg berani sidak kantor gedung dg aman super ketat terima kasih anies sdh adil negeri sdh langka
815,1412084956189265922,2021-07-05 16:24:23+00:00,https://twitter.com/ekowboy2/status/1412084956189265922,"PPKM Darurat yang ruwet, jokowi ditentang anaknya sendiri!!

Silahkan tonton akun youtube saya
🙏🙏
https://t.co/c5IuqP7G7K https://t.co/AespZkwsD4",239,10,97,,,,,,,ppkm darurat ruwet jokowi anak silah tonton akun youtube
816,1410506121563971591,2021-07-01 07:50:39+00:00,https://twitter.com/ekowboy2/status/1410506121563971591,"Tambahin ahhh.. biar makin rame!!
Pak Erick yg jadikan akhlak sbg core value BUMN kok gak risih ya

Kepada netizen yang budiman..
Waktu dan tempat kami persilahkan https://t.co/UUuBFrso7H",1980,131,951,,,,,,,tambahin ahhh biar rame erick yg akhlak sbg core value bumn gak risih ya netizen budiman silah
817,1410199869638144013,2021-06-30 11:33:43+00:00,https://twitter.com/ekowboy2/status/1410199869638144013,"Ini contoh budaya tata krama &amp; sopan santun dari komisaris kapal laut.. pak erik &amp; pak jokowi harus tau nih

Retweet ya gaes 💪 https://t.co/kH9OOSL20g",1877,189,1173,,,,,,,contoh budaya tata krama sopan santun komisaris kapal laut erik jokowi tau nih retweet ya gaes
818,1409488682415841288,2021-06-28 12:27:43+00:00,https://twitter.com/ekowboy2/status/1409488682415841288,"IBHRS cuma bilang apa yg dirasakan sehat wal afiat sblm hasil PCR keluar divonis 4th, ini yg piktor melecehkan martabat wanita kok bisa diangkat jadi komisaris BUMN.. 

Tolong arsipkan 💪 https://t.co/SKymUK18hz",3439,476,1741,,,,,,,ibhrs bilang yg sehat wal afiat sblm hasil pcr vonis 4th yg piktor leceh martabat wanita angkat komisaris bumn tolong arsip
819,1409417706596495363,2021-06-28 07:45:41+00:00,https://twitter.com/ekowboy2/status/1409417706596495363,"Saya salut dg Anies tiap saat dibully buzzerp, difitnah bahkan hendak diludahi komisaris BUMN.. tetap tenang selama tak ada ancaman fisik beliau amat hormati demokrasi

Pak Jokowi sdh dilindungi pasal penghinaan presiden kok rektor yg kelojotan, jgn jadikan kampus lembaga feodal!",1421,28,384,,,,,,,salut dg anies dibully buzzerp fitnah ludah komisaris bumn tenang ancam fisik beliau hormat demokrasi jokowi sdh lindung pasal hina presiden rektor yg kelojot jgn kampus lembaga feodal
820,1409128855265185798,2021-06-27 12:37:54+00:00,https://twitter.com/ekowboy2/status/1409128855265185798,"Oooohh.. Jadi begini akhlak komisaris BUMN yg mau ngeludahin muka Gub Anies, Uang pajak anda dipake buat gaji buzzer pandir penghinaan Ulama berotak mesum!!

Retweet ya gaes!! 💪 https://t.co/k3mmeeo0SS",2809,302,1873,,,,,,,oooohh akhlak komisaris bumn yg ngeludahin muka gub anies uang pajak dipake gaji buzzer pandir hina ulama otak mesum retweet ya gaes
821,1409079401141080064,2021-06-27 09:21:23+00:00,https://twitter.com/ekowboy2/status/1409079401141080064,"Ahmad Dhani ngetwit ""ludahi pendukung penista agama"" divonis 1,6 th penjara.. Lah ini komisaris BUMN digaji rakyat akhlaknya bejat begini apa bisa dijerat dg pasal yang sama!!

Prof @mohmahfudmd apa UU ITE masih berlaku, mohon tegakan keadilan 🙏🙏 https://t.co/4mbSnwLFth",2896,178,1331,,,,,,,ahmad dhani ngetwit ludah dukung nista agama vonis 1 6 th penjara komisaris bumn gaji rakyat akhlak bejat jerat dg pasal prof uu ite laku mohon tega adil
822,1408082141456465925,2021-06-24 15:18:38+00:00,https://twitter.com/ekowboy2/status/1408082141456465925,"Yang merekayasa, melaporkan, menangkap, memenjarakan, mentersangkakan, mendakwa, menuntut, memvonis secara dzalim IBHRS semoga Allah SWT hinakan &amp; sengsarakan hidupnya dunia akhirat..

Qobul Yaa RABB 🤲🤲
Tolong aamiinkan ayuhal muslimun!!",5112,1185,1312,,,,,,,rekayasa lapor tangkap penjara sangka dakwa tuntut vonis dzalim ibhrs moga allah swt hina sengsara hidup dunia akhirat qobul yaa rabb tolong aamiinkan ayuhal muslimun
823,1407946986054033416,2021-06-24 06:21:34+00:00,https://twitter.com/ekowboy2/status/1407946986054033416,"Vonis ULAMA VS MALING

Djoko Tjandra= vonis 4,5 th
Sjamsul Nursalim= SP3
Pinangki= vonis 4 th
IBHRS= vonis 4 th

Entah kapan terjadi keonaran sprti vonis yg dibacakan hakim, justru keonaran terjadi karena arogansi jaksa yg menghina gelar Imam Besar!!",2177,89,817,,,,,,,vonis ulama vs maling djoko tjandra vonis 4 5 th sjamsul nursalim sp3 pinangki vonis 4 th ibhrs vonis 4 th onar sprti vonis yg baca hakim onar arogansi jaksa yg hina gelar imam
824,1406549545371140097,2021-06-20 09:48:38+00:00,https://twitter.com/ekowboy2/status/1406549545371140097,"Anak tasik berbusana muslim dituduh teroris
Nusa Rara berpeci &amp; bergamis dibilang taliban
Tara Basro telanjang di socmed, ekspresi seni

Wapresnya Kiyai.. Menagnya komandan Banser tapi knp buzzer macam densi, kunted, armando yg anti-Islam dipelihara. MIRIS!! https://t.co/LLZyCYKh4e",970,25,414,,,,,,,anak tasik busana muslim tuduh teroris nusa rara peci gam bilang talib tara basro telanjang socmed ekspresi seni wapresnya kiyai menagnya komandan banser knp buzzer densi kunted armando yg anti - islam pelihara miris
825,1406497835382546434,2021-06-20 06:23:10+00:00,https://twitter.com/ekowboy2/status/1406497835382546434,"Peci putih, gamis selutut &amp; jilbab seleher itu ciri khas pakaian santri NU.. kalo pakaian khas Afganistan pake pakol &amp; burqa

Film Nusa Rara sdh penelitian lama krn pasarnya anak2 Nu makanya kalo goblok jgn kelewatan peke mengatasnamakan anak Indonesia punya anak aja kagak!! https://t.co/6nBkWW3cQA",968,68,315,,,,,,,peci putih gamis lutut jilbab leher ciri khas pakai santri nu kalo pakai khas afganistan pake pakol burqa film nusa rara sdh teliti krn pasar anak2 nu kalo goblok jgn peke mengatasnamakan anak indonesia anak aja kagak
826,1406437360204611587,2021-06-20 02:22:51+00:00,https://twitter.com/ekowboy2/status/1406437360204611587,"Hama demokrasi yang minta 3 periode ini jika dibiarkan maka akan dianggap suara rakyat padahal proyek buzzerp &amp; kakak pembina

Satu kata, LAWAN!!!
Kawal UUD 45 dari amandemen para penyembah jokowi &amp; penghianat reformasi.. #TangkapQodari",1308,62,456,,,,,,,hama demokrasi 3 periode biar anggap suara rakyat proyek buzzerp kakak bina lawan kawal uud 45 amandemen sembah jokowi penghianat reformasi tangkapqodari
827,1406226569220136970,2021-06-19 12:25:15+00:00,https://twitter.com/ekowboy2/status/1406226569220136970,"Qodari ini perusak demokrasi, pelanggar konstitusi &amp; penghianat reformasi hasutanya jabatan presiden 3 periode sungguh berbahaya dulu orba dilengserkan krn dianggap berkuasa terlalu lama..

Kini perjuangan mahasiswa dinodai demi jabatan komisaris, TANGKAP QODARI!!",1430,61,444,,,,,,,qodari usak demokrasi langgar konstitusi penghianat reformasi hasutanya jabat presiden 3 periode sungguh bahaya orba lengser krn anggap kuasa juang mahasiswa noda jabat komisaris tangkap qodari
828,1405894722275614720,2021-06-18 14:26:36+00:00,https://twitter.com/ekowboy2/status/1405894722275614720,"Saya secara konsisten menyebut IBHRS gak pernah dibayar &amp; saya bukan anggota FPI..

Gelar Imam Besar adalah wujud kecintaan juga penghormatan umat Islam tulus pada beliau yg tak goyah digoda uang &amp; jabatan serta tetap kokoh pada kebenaran meski dizalimi secara keji!!",2616,54,585,,,,,,,konsisten ibhrs gak bayar anggota fpi gelar imam wujud cinta hormat umat islam tulus beliau yg goyah goda uang jabat kokoh zalim keji
829,1405491290951720961,2021-06-17 11:43:31+00:00,https://twitter.com/ekowboy2/status/1405491290951720961,"Eks Napi penista agama nikmati limit kartu kredit 30 m dari negara, bansos rakyat kecil cuma 300 rb dikentit pula

Pinangki terima suap rugikan negara disunat masa tahannya, IBHRS tak laporkan hasil swab tak rugikan siapapun dituntut 6 th

DIMANA KEADILAN!!",1777,65,693,,,,,,,eks napi nista agama nikmat limit kartu kredit 30 m negara bansos rakyat 300 rb dikentit pinangki terima suap rugi negara sunat tahan ibhrs lapor hasil swab rugi tuntut 6 th adil
830,1399197308646920195,2021-05-31 02:53:28+00:00,https://twitter.com/ekowboy2/status/1399197308646920195,"Hoax &amp; fitnah si kunted bukan cuma masalah UAH tapi tanggung jawab kita semua krn yg diserang dana Umat serta muncul fitnah baru INH penyalur donasi punya kaitan dg teroris Syria..

Ini fitnah keji, pembunuhan karakter!! 
Pepet terus.. 💪 #TangkapEkoKuntadhi https://t.co/Z9DJHJUlrS",2372,213,1167,,,,,,,hoax fitnah si kunted uah tanggung krn yg serang dana umat muncul fitnah inh salur donasi kait dg teroris syria fitnah keji bunuh karakter pepet tangkapekokuntadhi
831,1398104099598442505,2021-05-28 02:29:27+00:00,https://twitter.com/ekowboy2/status/1398104099598442505,"Nama² yg muncul pelangar prokes di sidang IBHRS wajib diusut demi marwah pengadilan tinggi..

Pengakuan adanya diskriminasi kasus pelanggaran prokes scr tak langsung Hakim mengakui IBHRS didzalimi, mohon tanggapannya prof @mohmahfudmd 🙏 https://t.co/Sbw8903TJz",1375,47,539,,,,,,,nama2 yg muncul pelangar prokes sidang ibhrs wajib usut marwah adil diskriminasi langgar prokes scr langsung hakim ibhrs didzalimi mohon tanggap prof
832,1395921513950244865,2021-05-22 01:56:38+00:00,https://twitter.com/ekowboy2/status/1395921513950244865,"UUD 45
Penjajahan di atas dunia hrs dihapuskan.. 

Sila ke 2
Kemanusiaan yg adil &amp; beradab.. 

Israel itu penjajah yg biadab &amp; tdk berprikemanusiaan, Jadi kalo ada ormas atau partai yg pro-Israel wajib dibubarkan krn bertentangan dg konstitusi serta anti-Pancasila!!",475,16,142,,,,,,,uud 45 jajah dunia hrs hapus sila 2 manusia yg adil adab israel jajah yg biadab tdk berprikemanusiaan kalo ormas partai yg pro - israel wajib bubar krn dg konstitusi anti - pancasila
833,1395749354552496129,2021-05-21 14:32:32+00:00,https://twitter.com/ekowboy2/status/1395749354552496129,"CATAT PARTAI MANA YANG ELIT &amp; KADERNYA BELA PENJAJAH ISRAEL

MEREKALAH YANG AKAN KABUR DULUAN KE LUAR NEGERI JIKA TERJADI SESUATU DG BANGSA INI!!",1444,24,413,,,,,,,catat partai elit kader bela jajah israel kabur duluan negeri dg bangsa
834,1395712836752445445,2021-05-21 12:07:26+00:00,https://twitter.com/ekowboy2/status/1395712836752445445,"Ya Allah.. begini banget ya penyembah jokowi digaji rakyat cuma buat tebar kebencian.. 

Padahal presiden lengser di tengah jalan hal biasa apalagi kalo banyak hutang, suka bohong &amp; marak korupsi!! https://t.co/3nkcxTHPWG",410,29,156,,,,,,,ya allah banget ya sembah jokowi gaji rakyat tebar benci presiden lengser jalan kalo hutang suka bohong marak korupsi
835,1395696998016118784,2021-05-21 11:04:29+00:00,https://twitter.com/ekowboy2/status/1395696998016118784,"Kekalahan Israel bukan hanya krn genjatan senjata tapi krn rakyat Palestina telah memenangkan hati umat manusia sudah tidak ada ruang lagi bagi penjajah zionis di muka bumi!!

Rakyat Yordania meletupkan kegembiraannya di perbatasan 🇵🇸 #PalestinaMenang https://t.co/0wRa4rwRQK",439,14,141,,,,,,,kalah israel krn genjatan senjata krn rakyat palestina menang hati umat manusia ruang jajah zionis muka bumi rakyat yordania letup gembira batas palestinamenang
836,1395675668776583176,2021-05-21 09:39:44+00:00,https://twitter.com/ekowboy2/status/1395675668776583176,"Jumatan paling berkesan masjid2 bertakbir kabarkan kemenangan 🇵🇸 dilanjutkan dg aksi massa di seluruh negeri

Perang blm berakhir 🇮🇱 blm hengkang tapi kemerdekaan 🇵🇸 semakin dekat.. Sbgmn dulu pembebasan Kota Makah berawal dari genjatan senjata mitsaq Hudaibiah #PalestinaMenang",501,3,109,,,,,,,jumat kesan masjid2 takbir kabar menang dg aksi massa negeri perang blm blm hengkang merdeka sbgmn bebas kota makah genjatan senjata mitsaq hudaibiah palestinamenang
837,1395587068462440448,2021-05-21 03:47:40+00:00,https://twitter.com/ekowboy2/status/1395587068462440448,"Untuk pertama kali dalam sejarah rakyat Palestina shalat Subuh di Al-Aqsho tanpa intimidasi tentara zionis..

Yaa RAAB.. sempurnakan kemenangan rakyat Palestina, hinakan zionis bangsa biadab musnahkan mrk dari peradaban manusia 🤲
#PalestinaMenang https://t.co/xknWWkPxPb",6817,282,2048,,,,,,,kali sejarah rakyat palestina shalat subuh al - aqsho intimidasi tentara zionis yaa raab sempurna menang rakyat palestina hina zionis bangsa biadab musnah mrk adab manusia palestinamenang
838,1394953948373536770,2021-05-19 09:51:52+00:00,https://twitter.com/ekowboy2/status/1394953948373536770,"Bani Bipang bangkitlah!!! 
Ini ada kerjaan buat kalian... Ngawi pindah ke Jateng, Padang jadi provinsi... kalah jin aladin!!! 

 https://t.co/Ho727Uh1NX",299,29,80,,,,,,,bani bipang bangkit kerja ngawi pindah jateng padang provinsi kalah jin aladin
839,1394514896742539264,2021-05-18 04:47:14+00:00,https://twitter.com/ekowboy2/status/1394514896742539264,"Soedirman nyaris tertangkap Belanda krn londo Ireng, Merekapun sebar berita bohong Bung Dirman tdk loyal &amp; hendak kudeta Soekarno

Bermacam fitnah yahudi pesek pada Hamas utk bunuh karakter pejuang, setiap zaman ada penghianatnya! #WorldStandsWithPalestine https://t.co/PqjaeYOfp1",1273,24,513,,,,,,,soedirman tangkap belanda krn londo ireng sebar berita bohong dirman tdk loyal kudeta soekarno fitnah yahudi pesek hamas utk bunuh karakter juang zaman penghianatnya worldstandswithpalestine
840,1394284482761355269,2021-05-17 13:31:39+00:00,https://twitter.com/ekowboy2/status/1394284482761355269,"#YahudiPesek bilang ngapain ngumpulin donasi buat Palestina tetangga deket masih banyak yang susah...

Lah bansos dikorupsi grombolannya sendiri pada mingkem, Novel cs yg tangkap koruptor bansos malah dipecat pada dukung...

WOIII.. MARTIL.. MANA MARTIL!!",2231,92,732,,,,,,,yahudipesek bilang ngapain ngumpulin donasi palestina tetangga deket susah bansos korupsi grombolannya mingkem novel cs yg tangkap koruptor bansos pecat dukung woiii martil martil
841,1393951343388229633,2021-05-16 15:27:53+00:00,https://twitter.com/ekowboy2/status/1393951343388229633,"Yang dukung penista agama 
Yang dukung serbuan TKA china
Yang dukung Novel cs dipecat
Yang dukung penjajah Israel  

Ya orangnya itu-itu aja.. 
Yahudi pesek, Bipang nusantara!!
#IsraelStopPlayingVictim",2554,92,844,,,,,,,dukung nista agama dukung serbu tka china dukung novel cs pecat dukung jajah israel ya orang aja yahudi pesek bipang nusantara israelstopplayingvictim
842,1393735308076666880,2021-05-16 01:09:26+00:00,https://twitter.com/ekowboy2/status/1393735308076666880,"Di Indonesia belum pernah ada teror bom sebesar ini tapi pada teriak2 teroris agamanya Islam.. Ini Israel luluh lantahkan gedung jurnalis Al-jazeera yg dilindungi PBB pada mingkem

ENYAHLAH KALIAN YAHUDI PESEK!!
#IsraelTerrorist
 https://t.co/GmWDV0ubyS",3366,147,1513,,,,,,,indonesia teror bom teriak2 teroris agama islam israel luluh lantah gedung jurnalis al - jazeera yg lindung pbb mingkem enyah yahudi pesek israelterrorist
843,1393454046434926594,2021-05-15 06:31:48+00:00,https://twitter.com/ekowboy2/status/1393454046434926594,"Alasan banyak umat Kristiani &amp; rabbi Yahudi mendukung rakyat Palestina karena dulu datuk kami Salahuddin taklukkan yerusalem tanpa setetes darahpun jatuh

#IsraelTerrorism https://t.co/Z1FEP2FWZV",1069,9,413,,,,,,,alas umat kristiani rabbi yahudi dukung rakyat palestina datuk salahuddin takluk yerusalem tetes darah jatuh israelterrorism
844,1393388163519827970,2021-05-15 02:10:00+00:00,https://twitter.com/ekowboy2/status/1393388163519827970,"Malaysia bisa kompak bela 🇵🇸 karena disana gak ada buzzerp, disini banyak penghianat makanya penjajah pada betah..

Dana sdh cair mereka dikontrak sosialisasi pentingnya Impor TKA 🇮🇱 melalui calling visa, jgn heran mereka getol bela 🇮🇱.. LAWAN!! https://t.co/57bsaqVDDy",1075,32,424,,,,,,,malaysia kompak bela gak buzzerp penghianat jajah betah dana sdh cair kontrak sosialisasi impor tka calling visa jgn heran getol bela lawan
845,1393223104378281985,2021-05-14 15:14:07+00:00,https://twitter.com/ekowboy2/status/1393223104378281985,"Orasi Kiyai Ma'ruf dulu bersama FPI &amp; ormas Islam bela Palestina, sekarang beliau sudah dipucuk kekuasaan ngapain ya?? https://t.co/Ib4aMtZEp2",1688,121,644,,,,,,,orasi kiyai ma ruf fpi ormas islam bela palestina beliau pucuk kuasa ngapain ya
846,1393167857563824128,2021-05-14 11:34:35+00:00,https://twitter.com/ekowboy2/status/1393167857563824128,"IBHRS &amp; FPI yg mereka tuduh teroris punya rumah sakit, dapur umum serta sekolah di 🇵🇸

Yg ngaku anak ideologis Bung Karno malah dukung 🇮🇱, mereka musuh peradaban.. LAWAN!!",2281,34,791,,,,,,,ibhrs fpi yg tuduh teroris rumah sakit dapur sekolah yg ngaku anak ideologis karno dukung musuh adab lawan
